{
  "_id": "info",
  "template": "builtin:template",
  "description": "Standard template for a database's singleton info doc",
  "content": [
    {
      "format": "h1",
      "field": {
        "type": "text",
        "id": "_id"
      }
    },
    {
      "format": "h2",
      "text": "Templates"
    },
    {
      "format": "p",
      "id": "templates",
      "flexDirection": "column",
      "cell": {
        "field": {
          "id": "templates",
          "type": "text"
        }
      }
    },
    {
      "format": "h2",
      "text": "Views"
    },
    {
      "format": "p",
      "id": "views",
      "flexDirection": "column",
      "cell": {
        "field": {
          "id": "views",
          "type": "text"
        }
      }
    }
  ]
}
